{
  "$schema": "../schemas/connector.schema.json",
  "id": "usb-micro-b-v1",
  "version": "1.0.0",
  "name": "USB Micro-B receptacle",
  "housing": "USB Micro-B",
  "pins": [
    { "n": 1, "name": "VBUS", "role": "power" },
    { "n": 2, "name": "GND", "role": "ground" }
  ],
  "interfaces": ["power", "host"],
  "max_voltage": 5.5
}
